21:52:40.996633 IP localhost.50344 > 127.0.0.10.7777: Flags [P.], seq 1359283113:1359283206, ack 554831247, win 512, options [nop,nop,TS val 2954086684 ecr 328912778], length 93
21:52:40.996656 IP localhost.50344 > 127.0.0.10.7777: Flags [P.], seq 93:174, ack 1, win 512, options [nop,nop,TS val 2954086684 ecr 328912778], length 81
21:52:40.996700 IP 127.0.0.10.7777 > localhost.50344: Flags [.], ack 174, win 512, options [nop,nop,TS val 328922779 ecr 2954086684], length 0
21:52:40.996834 IP 127.0.0.10.7777 > localhost.50344: Flags [P.], seq 1:36, ack 174, win 512, options [nop,nop,TS val 328922779 ecr 2954086684], length 35
21:52:40.996838 IP localhost.50344 > 127.0.0.10.7777: Flags [.], ack 36, win 512, options [nop,nop,TS val 2954086684 ecr 328922779], length 0
21:52:41.234144 IP localhost.59356 > 127.0.0.10.7777: Flags [P.], seq 797628041:797628157, ack 3152680371, win 512, options [nop,nop,TS val 2954086921 ecr 328913008], length 116
21:52:41.234167 IP localhost.59356 > 127.0.0.10.7777: Flags [P.], seq 116:197, ack 1, win 512, options [nop,nop,TS val 2954086921 ecr 328913008], length 81
21:52:41.234207 IP 127.0.0.10.7777 > localhost.59356: Flags [.], ack 197, win 512, options [nop,nop,TS val 328923016 ecr 2954086921], length 0
21:52:41.234349 IP 127.0.0.10.7777 > localhost.59356: Flags [P.], seq 1:36, ack 197, win 512, options [nop,nop,TS val 328923016 ecr 2954086921], length 35
21:52:41.234354 IP localhost.59356 > 127.0.0.10.7777: Flags [.], ack 36, win 512, options [nop,nop,TS val 2954086921 ecr 328923016], length 0
21:52:45.541022 IP localhost.43218 > 127.0.0.10.7777: Flags [P.], seq 2958000229:2958000323, ack 1464446652, win 512, options [nop,nop,TS val 2954091228 ecr 328917321], length 94
21:52:45.541046 IP localhost.43218 > 127.0.0.10.7777: Flags [P.], seq 94:175, ack 1, win 512, options [nop,nop,TS val 2954091228 ecr 328917321], length 81
21:52:45.541087 IP 127.0.0.10.7777 > localhost.43218: Flags [.], ack 175, win 512, options [nop,nop,TS val 328927323 ecr 2954091228], length 0
21:52:45.541224 IP 127.0.0.10.7777 > localhost.43218: Flags [P.], seq 1:36, ack 175, win 512, options [nop,nop,TS val 328927323 ecr 2954091228], length 35
21:52:45.541229 IP localhost.43218 > 127.0.0.10.7777: Flags [.], ack 36, win 512, options [nop,nop,TS val 2954091228 ecr 328927323], length 0
21:52:50.998346 IP localhost.50344 > 127.0.0.10.7777: Flags [P.], seq 174:267, ack 36, win 512, options [nop,nop,TS val 2954096685 ecr 328922779], length 93
21:52:50.998367 IP localhost.50344 > 127.0.0.10.7777: Flags [P.], seq 267:348, ack 36, win 512, options [nop,nop,TS val 2954096685 ecr 328922779], length 81
21:52:50.998415 IP 127.0.0.10.7777 > localhost.50344: Flags [.], ack 348, win 512, options [nop,nop,TS val 328932781 ecr 2954096685], length 0
21:52:50.998553 IP 127.0.0.10.7777 > localhost.50344: Flags [P.], seq 36:71, ack 348, win 512, options [nop,nop,TS val 328932781 ecr 2954096685], length 35
21:52:50.998558 IP localhost.50344 > 127.0.0.10.7777: Flags [.], ack 71, win 512, options [nop,nop,TS val 2954096686 ecr 328932781], length 0
21:52:51.242166 IP localhost.59356 > 127.0.0.10.7777: Flags [P.], seq 197:290, ack 36, win 512, options [nop,nop,TS val 2954096929 ecr 328923016], length 93
21:52:51.242187 IP localhost.59356 > 127.0.0.10.7777: Flags [P.], seq 290:371, ack 36, win 512, options [nop,nop,TS val 2954096929 ecr 328923016], length 81
21:52:51.242301 IP 127.0.0.10.7777 > localhost.59356: Flags [.], ack 371, win 512, options [nop,nop,TS val 328933024 ecr 2954096929], length 0
21:52:51.242438 IP 127.0.0.10.7777 > localhost.59356: Flags [P.], seq 36:71, ack 371, win 512, options [nop,nop,TS val 328933025 ecr 2954096929], length 35
21:52:51.242443 IP localhost.59356 > 127.0.0.10.7777: Flags [.], ack 71, win 512, options [nop,nop,TS val 2954096930 ecr 328933025], length 0
21:52:55.542160 IP localhost.43218 > 127.0.0.10.7777: Flags [P.], seq 175:269, ack 36, win 512, options [nop,nop,TS val 2954101229 ecr 328927323], length 94
21:52:55.542185 IP localhost.43218 > 127.0.0.10.7777: Flags [P.], seq 269:350, ack 36, win 512, options [nop,nop,TS val 2954101229 ecr 328927323], length 81
21:52:55.542231 IP 127.0.0.10.7777 > localhost.43218: Flags [.], ack 350, win 512, options [nop,nop,TS val 328937324 ecr 2954101229], length 0
21:52:55.542569 IP 127.0.0.10.7777 > localhost.43218: Flags [P.], seq 36:71, ack 350, win 512, options [nop,nop,TS val 328937325 ecr 2954101229], length 35
21:52:55.542574 IP localhost.43218 > 127.0.0.10.7777: Flags [.], ack 71, win 512, options [nop,nop,TS val 2954101230 ecr 328937325], length 0
21:53:01.000419 IP localhost.50344 > 127.0.0.10.7777: Flags [P.], seq 348:440, ack 71, win 512, options [nop,nop,TS val 2954106688 ecr 328932781], length 92
21:53:01.000441 IP localhost.50344 > 127.0.0.10.7777: Flags [P.], seq 440:521, ack 71, win 512, options [nop,nop,TS val 2954106688 ecr 328932781], length 81
21:53:01.000489 IP 127.0.0.10.7777 > localhost.50344: Flags [.], ack 521, win 512, options [nop,nop,TS val 328942783 ecr 2954106688], length 0
21:53:01.000628 IP 127.0.0.10.7777 > localhost.50344: Flags [P.], seq 71:106, ack 521, win 512, options [nop,nop,TS val 328942783 ecr 2954106688], length 35
21:53:01.000632 IP localhost.50344 > 127.0.0.10.7777: Flags [.], ack 106, win 512, options [nop,nop,TS val 2954106688 ecr 328942783], length 0
21:53:01.250573 IP localhost.59356 > 127.0.0.10.7777: Flags [P.], seq 371:464, ack 71, win 512, options [nop,nop,TS val 2954106938 ecr 328933025], length 93
21:53:01.250595 IP localhost.59356 > 127.0.0.10.7777: Flags [P.], seq 464:545, ack 71, win 512, options [nop,nop,TS val 2954106938 ecr 328933025], length 81
21:53:01.250637 IP 127.0.0.10.7777 > localhost.59356: Flags [.], ack 545, win 512, options [nop,nop,TS val 328943033 ecr 2954106938], length 0
21:53:01.250773 IP 127.0.0.10.7777 > localhost.59356: Flags [P.], seq 71:106, ack 545, win 512, options [nop,nop,TS val 328943033 ecr 2954106938], length 35
21:53:01.250777 IP localhost.59356 > 127.0.0.10.7777: Flags [.], ack 106, win 512, options [nop,nop,TS val 2954106938 ecr 328943033], length 0
21:53:05.543498 IP localhost.43218 > 127.0.0.10.7777: Flags [P.], seq 350:444, ack 71, win 512, options [nop,nop,TS val 2954111231 ecr 328937325], length 94
21:53:05.543554 IP localhost.43218 > 127.0.0.10.7777: Flags [P.], seq 444:525, ack 71, win 512, options [nop,nop,TS val 2954111231 ecr 328937325], length 81
21:53:05.543639 IP 127.0.0.10.7777 > localhost.43218: Flags [.], ack 525, win 512, options [nop,nop,TS val 328947326 ecr 2954111231], length 0
21:53:05.543988 IP 127.0.0.10.7777 > localhost.43218: Flags [P.], seq 71:106, ack 525, win 512, options [nop,nop,TS val 328947326 ecr 2954111231], length 35
21:53:05.544005 IP localhost.43218 > 127.0.0.10.7777: Flags [.], ack 106, win 512, options [nop,nop,TS val 2954111231 ecr 328947326], length 0
21:53:11.002141 IP localhost.50344 > 127.0.0.10.7777: Flags [P.], seq 521:613, ack 106, win 512, options [nop,nop,TS val 2954116689 ecr 328942783], length 92
21:53:11.002168 IP localhost.50344 > 127.0.0.10.7777: Flags [P.], seq 613:694, ack 106, win 512, options [nop,nop,TS val 2954116689 ecr 328942783], length 81
21:53:11.002228 IP 127.0.0.10.7777 > localhost.50344: Flags [.], ack 694, win 512, options [nop,nop,TS val 328952784 ecr 2954116689], length 0
21:53:11.002419 IP 127.0.0.10.7777 > localhost.50344: Flags [P.], seq 106:141, ack 694, win 512, options [nop,nop,TS val 328952785 ecr 2954116689], length 35
21:53:11.002426 IP localhost.50344 > 127.0.0.10.7777: Flags [.], ack 141, win 512, options [nop,nop,TS val 2954116690 ecr 328952785], length 0
21:53:11.258617 IP localhost.59356 > 127.0.0.10.7777: Flags [P.], seq 545:639, ack 106, win 512, options [nop,nop,TS val 2954116946 ecr 328943033], length 94
21:53:11.258650 IP localhost.59356 > 127.0.0.10.7777: Flags [P.], seq 639:720, ack 106, win 512, options [nop,nop,TS val 2954116946 ecr 328943033], length 81
21:53:11.258710 IP 127.0.0.10.7777 > localhost.59356: Flags [.], ack 720, win 512, options [nop,nop,TS val 328953041 ecr 2954116946], length 0
21:53:11.258934 IP 127.0.0.10.7777 > localhost.59356: Flags [P.], seq 106:141, ack 720, win 512, options [nop,nop,TS val 328953041 ecr 2954116946], length 35
21:53:11.258943 IP localhost.59356 > 127.0.0.10.7777: Flags [.], ack 141, win 512, options [nop,nop,TS val 2954116946 ecr 328953041], length 0

